<?xml version="1.0" encoding="utf-8"?>
<product desc="Anything in the economy." id="100035" name="Product" xmlns:xsi="http://www.w3.org/2001/XMLSchema-instance" xsi:noNamespaceSchemaLocation="products.xsd">

   <product id="101000" name="Public">

      <product id="83101800" name="Electricity" desc="Electric power" prefix="kilo" unit="joule" price="35" />
      <product id="83101500" name="Water and sewer" desc="Water and sewer utilities" price="0" />
      <product id="78100000" name="Transport" desc="Hub system, logistic" prefix="kilo" unit="metre" price="112" />
      <product id="85101500" name="Medical care" desc="Healthcare center" unit="hour" price="0" />
      <product id="91111600" name="Personal assistance" desc="Personal assistance and care" unit="hour" />
      <product id="83121702" name="Radio DIY" desc="Radio service" price="0" />
      <product id="10171504" name="Compost" desc="Composted organic materials" prefix="kilo" unit="gram" price="15" />

   </product>

   <product id="102000" name="Basic">

      <product id="50001000" name="Materials">
         <product id="11121710" name="Charcoal" desc="Charcoal fuel" unit="tonne" price="120000" />
         <product id="15111500" name="Wood gas" desc="Gaseous fuel" unit="metre_3" price="90000" />
         <product id="30000000" name="Plank" desc="Construction material" unit="metre" price="50" />
         <product id="11121707" name="Insulation" desc="Wood wool" unit="bale" price="200" />
         <product id="14110000" name="Paper" desc="Paper roll" unit="piece" price="1700" />
         <product id="11161805" name="Velvet textile" desc="Synthetic velvet" unit="metre" price="30" />
         <product id="11162300" name="Leather" desc="Leather material" unit="metre_2" price="660" />
         <product id="11161600" name="Wool" desc="Wool textile" unit="metre" price="60" />
      </product>

      <product id="50001000" name="Food">
         <product id="50101538" name="Vegetables" desc="Vegetable crops" analogue="true" prefix="kilo" unit="gram" price="65" change="-15">
            <product id="50101502" name="Potatoes" desc="Freash potatoes" prefix="kilo" unit="gram" price="65" change="-15" />
            <product id="50101503" name="Cabbage" desc="Freash cabbage" prefix="kilo" unit="gram" price="65" change="-15" />
            <product id="50101504" name="Pumpkins" desc="Freash pumpkins" prefix="kilo" unit="gram" price="65" change="-15" />
         </product>
         <product id="50111000" name="Meat" desc="Freash meat">
            <product id="50111512" name="Pig" desc="Freash pig meat" prefix="kilo" unit="gram" price="300" />
            <product id="50111513" name="Cheep" desc="Freash cheep meat" prefix="kilo" unit="gram" price="400" />
         </product>
         <product id="50001001" name="Other">
            <product id="50221100" name="Flour" desc="Ground cereal, silted" prefix="kilo" unit="gram" price="40" />
            <product id="50121500" name="Fish" desc="Freash fish, filed" prefix="kilo" unit="gram" price="960" />
            <product id="50101541" name="Mushrooms" desc="Freash mushrooms" prefix="kilo" unit="gram" price="200" />
         </product>
      </product>

   </product>

   <product id="103000" name="Derived">
      <product id="55101500" name="News paper" desc="Printed publication" unit="piece" price="40" />
      <product id="27112005" name="Axe" desc="Sharp axe" unit="piece" price="800" />
      <product id="27112002" name="Spade" desc="Digging spade" unit="piece" price="1000" />
      <product id="21101504" name="Weeder" desc="Agricultural machinery" unit="piece" price="100000" />
      <product id="50181901" name="Bread" desc="Fresh bread loaf" unit="piece" price="75" />
      <product id="50182001" name="Pumpkin pie" desc="Fruit pie" unit="piece" price="100" />
      <product id="53101500" name="Trousers" desc="Unisex trousers" unit="piece" price="500" />
      <product id="53101604" name="Blous" desc="Velvet blous" unit="piece" price="450" />
      <product id="53103000" name="Tshirt" desc="Standard Tshirt" unit="piece" price="400" />
      <product id="56101515" name="Bed" desc="Rattan bed" unit="piece" price="15000" />
      <product id="56101519" name="Table" desc="Birch wood table" unit="piece" price="5000" />
      <product id="43171800" name="Laptop" desc="Computer hardware" unit="piece" price="25000" />
      <product id="34101009" name="Mobile" desc="Mobile telephone" unit="piece" price="15000" />
      <product id="25101600" name="Truck" desc="Cargo vehicle" unit="piece" price="1250000" />
      <product id="25101500" name="Bus" desc="Passenger vehicles" unit="piece" price="1000000" />
   </product>

   <product id="104000" name="Services">
      <product id="91100000" name="Hair cut" desc="Personal appearance" price="700" />
      <product id="72100000" name="Repairs" desc="Repairs and maintenance" unit="hour" price="1400" />
      <product id="90101500" name="Restaurant meal" desc="Eating and drinking establishment" price="1000" />
   </product>

</product>
