<?xml version="1.0" encoding="utf-8"?>
<product desc="Any job" id="100001" name="Job" xmlns:xsi="http://www.w3.org/2001/XMLSchema-instance" xsi:noNamespaceSchemaLocation="products.xsd">

    <product id="5" name="BBA Cables" desc="Work at BBA Cables">
        <product id="73120000" name="Machine operator" desc="High power cable machine operator" amount="1.0" unit="Hour" price="650"/>
    </product>

    <product id="1" name="University" desc="Formosa heights university">
        <product id="86121721" name="Design" desc="Design studies" amount="1.0" unit="Hour" price="20"/>
        <product id="86121715" name="Math studies" desc="University studies, level three mathematics" amount="1.0" unit="Hour" price="125"/>
    </product>

    <product desc="The Farmland cooperative" id="7" name="Farmland coop">
        <product id="70140000" name="Weeding" desc="Crop production and management and protection" amount="1.0" unit="Hour" price="400"/>
        <product id="70130001" name="Compost manager" desc="Managing the compost operation" amount="1.0" unit="Hour" price="25"/>
        <product id="70130000" name="Earth works" desc="Land and soil preparation and management and protection" amount="1.0" unit="Hour" price="255"/>
    </product>

</product>
