<?xml version="1.0" encoding="utf-8"?>
<product desc="Anything in the economy." id="100035" name="Product" xmlns:xsi="http://www.w3.org/2001/XMLSchema-instance" xsi:noNamespaceSchemaLocation="products.xsd">

   <product id="101000" name="Public">

      <product id="83101800" name="Electricity" desc="Electric power" prefix="Kilo" unit="Juole" price="35" />
      <product id="83101500" name="Water and sewer" desc="Water and sewer utilities" unit="Metre_3" price="0" />
      <product id="78100000" name="Transport" desc="Hub system, logistic" prefix="Kilo" unit="Metre" price="112" />
      <product id="85101500" name="Medical care" desc="Healthcare center" unit="Hour" price="0" />
      <product id="91111600" name="Personal assistance" desc="Personal assistance and care" unit="Hour" price="0" />
      <product id="83121702" name="Radio DIY" desc="Radio service" price="0" />
      <product id="10171504" name="Compost" desc="Composted organic materials" />

   </product>

   <product id="102000" name="Basic">

      <product id="50001000" name="Materials">
         <product id="11121710" name="Charcoal" desc="Charcoal fuel" unit="Tonne" />
         <product id="15111500" name="Wood gas" desc="Gaseous fuel" unit="Metre_3" />
         <product id="30000000" name="Plank" desc="Construction material" unit="Metre" />
         <product id="11121707" name="Insulation" desc="Wood wool bale" unit="Piece" />
         <product id="14110000" name="Paper" desc="Paper roll" unit="Piece" />
         <product id="11161805" name="Velvet textile" desc="Synthetic velvet" unit="Metre" />
         <product id="11162300" name="Leather" desc="Leather material" unit="Metre" />
         <product id="11161600" name="Wool" desc="Wool textile" unit="Metre" />
      </product>

      <product id="50001000" name="Food">
         <product id="50101538" name="Vegetables" analogue="true" price="80" desc="Vegetable crops" prefix="kilo" unit="gram" change="15">
            <product id="50101502" name="Potatoes" desc="Freash potatoes" prefix="kilo" unit="gram" />
            <product id="50101503" name="Cabbage" desc="Freash cabbage" prefix="kilo" unit="gram" />
            <product id="50101504" name="Pumpkins" desc="Freash pumpkins" prefix="kilo" unit="gram" />
         </product>
         <product id="50111000" name="Meat" analogue="true" price="250" prefix="kilo" unit="gram" change="15">
            <product name="Pig" desc="Freash pig meat" id="50111512" prefix="kilo" unit="gram" />
            <product name="Cheep" desc="Freash cheep meat" id="50111513" prefix="kilo" unit="gram" />
         </product>
         <product id="50001001" name="Other">
            <product name="Flour" desc="Cereal product" id="50221100" prefix="kilo" unit="gram" />
            <product name="Fish" desc="Freash fish" id="50121500" prefix="kilo" unit="gram" />
            <product name="Mushrooms" desc="Freash mushrooms" id="50101541" prefix="kilo" unit="gram" />
         </product>
      </product>

   </product>

   <product id="103000" name="Derived">
      <product id="55101500" name="News paper" desc="Printed publication" unit="Piece" price="60" />
      <product id="27112005" name="Axe" desc="Sharp axe" unit="Piece" />
      <product id="27112002" name="Spade" desc="Digging spade" unit="Piece" />
      <product id="21101504" name="Weeder" desc="Agricultural machinery" ssunit="Piece" />
      <product id="50181901" name="Bread" desc="Fresh bread loaf" unit="Piece" />
      <product id="50182001" name="Apple pie" desc="Fruit pie" unit="Piece" />
      <product id="53101500" name="Trousers" desc="Unisex trousers" unit="Piece" />
      <product id="53101604" name="Blous" desc="Velvet blous" unit="Piece" />
      <product id="53103000" name="Tshirt" desc="Standard Tshirt" unit="Piece" />
      <product id="56101515" name="Bed" desc="Rattan bed" unit="Piece" />
      <product id="56101519" name="Table" desc="Birch wood table" unit="Piece" />
      <product id="43171800" name="Laptop" desc="Computer hardware" unit="Piece" />
      <product id="34101009" name="Mobile" desc="Mobile telephone" unit="Piece" />
      <product id="25101600" name="Truck" desc="Cargo vehicle" unit="Piece" price="950000" />
      <product id="25101500" name="Bus" desc="Passenger vehicles" unit="Piece" price="800000" />
   </product>

   <product id="104000" name="Services">
      <product id="91100000" name="Hair cut" desc="Personal appearance" />
      <product id="72100000" name="Repairs" desc="Repairs and maintenance" />
      <product id="90101500" name="Restaurant" desc="Eating and drinking establishment" />
   </product>

</product>
